{
  "authority": {
    "principals": [
      {
        "id": "example-operator",
        "kind": "human",
        "roles": [
          "operator"
        ]
      },
      {
        "id": "example-orchestrator",
        "kind": "agent",
        "roles": [
          "orchestrator"
        ]
      },
      {
        "id": "example-executor",
        "kind": "agent",
        "roles": [
          "executor"
        ]
      },
      {
        "id": "example-reviewer",
        "kind": "agent",
        "roles": [
          "reviewer"
        ]
      },
      {
        "id": "example-publisher",
        "kind": "automation",
        "roles": [
          "publisher"
        ]
      }
    ],
    "roles": [
      {
        "capabilities": [
          "accept-intent",
          "accept-loop-design",
          "accept-source-publication",
          "activate-binding",
          "authorize-run",
          "decide-evolution",
          "escalate"
        ],
        "description": "Accepts intent, loop design, evolution, and bindings.",
        "id": "operator"
      },
      {
        "capabilities": [
          "route-run",
          "accept-parent",
          "escalate"
        ],
        "description": "Routes accepted outcomes without changing their authority.",
        "id": "orchestrator"
      },
      {
        "capabilities": [
          "execute-work",
          "produce-evidence",
          "escalate"
        ],
        "description": "Produces scoped candidates and factual evidence.",
        "id": "executor"
      },
      {
        "capabilities": [
          "review-candidate",
          "accept-gate",
          "produce-evidence",
          "escalate"
        ],
        "description": "Independently evaluates a pinned candidate.",
        "id": "reviewer"
      },
      {
        "capabilities": [
          "execute-work",
          "publish-release",
          "produce-evidence",
          "escalate"
        ],
        "description": "Performs one explicitly authorized external effect.",
        "id": "publisher"
      }
    ],
    "separation_rules": [
      {
        "applies_to_loop_ids": [
          "review-candidate",
          "assure-release",
          "review-comprehension",
          "review-successor"
        ],
        "disallow_same_principal": true,
        "id": "author-verification-separation",
        "review_capability": "review-candidate",
        "subject_capability": "execute-work"
      }
    ]
  },
  "evidence": {
    "accepted_results": [
      "pass",
      "fail",
      "indeterminate"
    ],
    "child_receipts_auto_accept_parent": false,
    "content_addressed": true,
    "require_candidate_digest": true,
    "require_policy_digest": true
  },
  "evolution": {
    "activation_capability": "activate-binding",
    "allow_self_activation": false,
    "decision_capability": "decide-evolution",
    "governance_source": "proposal.base_binding_digest",
    "minimum_repeated_signals": 2,
    "proposal_capability": "route-run"
  },
  "execution": {
    "allowed_tools": [
      "git",
      "github",
      "imagegen",
      "orca",
      "python",
      "web"
    ],
    "control_plane": {
      "actions": [
        "new",
        "authorize",
        "record-attempt",
        "record-evidence",
        "complete"
      ],
      "candidate_write": false,
      "runner_principal_id": "example-orchestrator",
      "state_path": ".concord"
    },
    "default_budgets": {
      "max_attempts": 3,
      "max_cost_units": 10,
      "max_elapsed_seconds": 3600,
      "on_exhaustion": "failed"
    },
    "default_scope": {
      "external_mutations": [
        "github-organization-profile",
        "github-pages",
        "github-pull-request",
        "github-pull-request-merge",
        "github-release-assets",
        "github-repository-homepage",
        "github-repository-security-settings",
        "github-repository-social-preview",
        "github-repository-source",
        "github-version-tag"
      ],
      "network": "write",
      "read_paths": [
        ".agents",
        ".concord/research",
        ".concord/runs",
        ".github",
        ".github/dependabot.yml",
        ".github/workflows",
        ".gitignore",
        "AGENTS.md",
        "CITATION.cff",
        "LICENSE",
        "NOTICE",
        "README.md",
        "README.ru.md",
        "concord",
        "docs",
        "docs/ARCHITECTURE.md",
        "docs/ARTICLE.md",
        "docs/ATLAS.html",
        "docs/ATLAS.md",
        "docs/CONCEPTS.md",
        "docs/DECISIONS.md",
        "docs/QUICKSTART.md",
        "docs/RELEASE.md",
        "docs/SPEC_V0.1.md",
        "docs/TRUST_MODEL.md",
        "docs/assets",
        "docs/assets/concordloom-mark.png",
        "docs/assets/concordloom-social-preview.png",
        "docs/research",
        "docs/ru",
        "docs/ru/ARCHITECTURE.md",
        "docs/ru/ARTICLE.md",
        "docs/ru/ATLAS.html",
        "docs/ru/ATLAS.md",
        "docs/ru/CONCEPTS.md",
        "docs/ru/DECISIONS.md",
        "docs/ru/QUICKSTART.md",
        "docs/ru/RELEASE.md",
        "docs/ru/SPEC_V0.1.md",
        "docs/ru/TRUST_MODEL.md",
        "docs/ru/research",
        "examples",
        "framework",
        "framework/concordloom",
        "framework/concordloom/catalog.json",
        "framework/generic-sdlc",
        "plugins",
        "pyproject.toml",
        "schemas",
        "site",
        "site/data",
        "src",
        "src/concordloom/atlas.py",
        "src/concordloom/canonical.py",
        "src/concordloom/catalog.py",
        "src/concordloom/cli.py",
        "src/concordloom/compiler.py",
        "src/concordloom/evolution.py",
        "src/concordloom/inspection.py",
        "src/concordloom/interview.py",
        "src/concordloom/loops.py",
        "src/concordloom/run.py",
        "tests",
        "tools",
        "tools/build_site.py",
        "tools/check.sh",
        "tools/check_docs.py",
        "tools/check_language.py",
        "tools/check_site.py"
      ],
      "write_paths": [
        ".agents",
        ".concord/research",
        ".github/dependabot.yml",
        ".github/workflows",
        ".gitignore",
        "AGENTS.md",
        "CITATION.cff",
        "LICENSE",
        "NOTICE",
        "README.md",
        "README.ru.md",
        "concord",
        "docs",
        "docs/ARCHITECTURE.md",
        "docs/ARTICLE.md",
        "docs/ATLAS.html",
        "docs/ATLAS.md",
        "docs/CONCEPTS.md",
        "docs/DECISIONS.md",
        "docs/QUICKSTART.md",
        "docs/RELEASE.md",
        "docs/SPEC_V0.1.md",
        "docs/TRUST_MODEL.md",
        "docs/assets",
        "docs/research",
        "docs/ru",
        "docs/ru/ARCHITECTURE.md",
        "docs/ru/ARTICLE.md",
        "docs/ru/ATLAS.html",
        "docs/ru/ATLAS.md",
        "docs/ru/CONCEPTS.md",
        "docs/ru/DECISIONS.md",
        "docs/ru/QUICKSTART.md",
        "docs/ru/RELEASE.md",
        "docs/ru/SPEC_V0.1.md",
        "docs/ru/TRUST_MODEL.md",
        "docs/ru/research",
        "examples",
        "framework/concordloom",
        "framework/generic-sdlc",
        "plugins",
        "pyproject.toml",
        "schemas",
        "site",
        "site/data",
        "src",
        "src/concordloom/atlas.py",
        "src/concordloom/canonical.py",
        "src/concordloom/catalog.py",
        "src/concordloom/cli.py",
        "src/concordloom/compiler.py",
        "src/concordloom/evolution.py",
        "src/concordloom/inspection.py",
        "src/concordloom/interview.py",
        "src/concordloom/loops.py",
        "src/concordloom/run.py",
        "tests",
        "tools",
        "tools/build_site.py",
        "tools/check.sh",
        "tools/check_docs.py",
        "tools/check_language.py",
        "tools/check_site.py"
      ]
    },
    "local_first": true,
    "model_policy": {
      "allowed_content_classes": [
        "metadata",
        "history",
        "source",
        "tests",
        "documentation",
        "configuration",
        "evidence"
      ],
      "allowed_models": [
        {
          "model": "none",
          "provider": ""
        },
        {
          "model": "gpt-5",
          "provider": "openai"
        }
      ],
      "allowed_path_prefixes": [
        "."
      ],
      "allowed_providers": [
        "openai"
      ],
      "max_cost_units": 10,
      "privacy": "public_data_only",
      "public_content_classes": [
        "metadata",
        "history",
        "source",
        "tests",
        "documentation",
        "configuration",
        "evidence"
      ],
      "record_effective_model": true
    }
  },
  "id": "concordloom-self-policy-v7",
  "kind": "concordloom.policy",
  "routing": {
    "operator_selects_outcomes": true,
    "orchestrator_selects_machinery": true,
    "record_effective_route": true,
    "record_planned_route": true
  },
  "schema_version": "0.1"
}
